cui	definition
C1280597	Entire superior duodenal fold
C1280600	Entire inferior duodenal fold
C1280601	Entire paraduodenal fold
C1280611	Entire anterior mediastinum
C1280612	Entire inframammary region
C1280613	Entire lateral umbilical fold
C1280614	Body Regions
C1280615	Entire root of mesentery
C1280626	Entire ileocecal fold
C1280628	Entire vascular fold of cecum
C1280657	Structure of angle of rib
C1280671	Entire mesenteric border of jejunum
C1280676	Entire anti-mesenteric border of jejunum
C1280681	Entire proximal portion of ileum
C1280682	Entire middle portion of ileum
C1280684	Entire mesenteric border of ileum
C1280687	Entire hilum of lung
C1280689	Entire anti-mesenteric border of ileum
C1280694	Entire pituitary fossa
C1280741	Entire male perineum
C1280743	Entire female perineum
C1280756	Entire superior flexure of duodenum
C1280757	Entire inferior flexure of duodenum
C1280762	Entire mesenteric border of small intestine
C1280763	Entire anti-mesenteric border of small intestine
C1280780	Entire gastric foveola
C1280782	Entire villous fold of stomach
C1280784	Entire caudal one third of stomach
C1280787	Entire area gastrica
C1280808	Entire duodenal impression of liver
C1280809	Entire colic impression of liver
C1280810	Entire renal impression of liver
C1280811	Entire adrenal impression of liver
C1280815	Entire groove of ligamentum venosum of liver
C1280821	Entire gastric impression of liver
C1280843	Entire lateral margin of tongue
C1280907	Entire perirectal region
C1280908	Entire retrovaginal region
C1280912	Entire upper third of esophagus
C1280913	Entire middle third of esophagus
C1280925	Entire posterior wall of oropharynx
C1280926	Structure of pharyngeal recess
C1280927	Entire posterior wall of hypopharynx
C1280944	Entire low right atrium
C1280948	Entire pulmonary surface of heart
C1280969	Inguinal triangle
C1280970	Entire inguinal ring
C1280991	Entire frontal region
C1281007	Entire jugular notch of sternum
C1281009	Entire postcentral gyrus
C1281030	Entire precordium
C1281031	Entire parasternal region
C1281087	Entire anterior surface of kidney
C1281088	Entire posterior surface of kidney
C1281089	Entire lateral border of kidney
C1281090	Entire medial border of kidney
C1281099	Region of metatarsal
C1281114	Entire lateral glossoepiglottic fold
C1281146	Entire anterior surface of prostate
C1281147	Entire posterior surface of prostate
C1281148	Entire inferolateral surface of prostate
C1281184	Entire posterior surface of pancreas
C1281185	Entire inferior surface of pancreas
C1281192	Entire anterior surface of adrenal gland
C1281193	Entire posterior surface of adrenal gland
C1281213	Entire retropharyngeal area
C1281261	Entire equator of eyeball
C1281273	Entire external surface of sclera
C1281301	Entire anterior surface of iris
C1281302	Entire posterior surface of iris
C1281343	Entire presacral region
C1281430	Entire acetabular fossa
C1281432	Entire roof of acetabulum
C1281433	Entire lunar surface of acetabulum
C1281434	Entire articular surface of acetabulum
C1281451	Entire superior articular facet of sacrum
C1281453	Entire pelvic aspect of sacrum
C1281468	Entire symphysial surface of pubis
C1281470	Entire iliopubic eminence
C1281538	Entire free edge of nail
C1281585	Entire hip region
C1281593	Entire back (surface region)
C1281621	Entire iliopectinate arch of iliac fascia
C1281716	Entire lateral arch of foot
C1281835	Entire distal end of humerus
C1281843	Entire sacroiliac region
C1281864	Entire apex of patella
C1281865	Entire infrascapular region of back
C1281866	Entire costovertebral angle of twelfth rib
C1282104	Seminal vesicle wall
C1282130	region of kidney
C1282377	Entire apex of lung
C1282378	Entire base of lung
C1282618	Entire multiple topographic sites
C1282649	Entire cleavage lines of skin
C1282711	Entire paracortical area of lymph node
C1282728	Entire diaphragmatic surface of spleen
C1282729	Entire visceral surface of spleen
C1282730	Entire gastric surface of spleen
C1282732	Entire renal surface of spleen
C1282733	Entire colic surface of spleen
C1282734	Structure of posterior extremity of spleen
C1282735	Lower pole of spleen
C1282737	Entire superior margin of spleen
C1282738	Entire inferior margin of spleen
C1282768	Entire proximal third of shaft of bone
C1282769	Entire middle third of shaft of bone
C1282771	Entire distal third of shaft of bone
C1282772	Entire articular surface of bone
C1282863	Entire organ capsule
C1282865	Entire organ cavity subdivision
C1283682	Region of nasopharynx
C1283792	Body Regions
C1283835	Body Regions
C1283836	Arm
C1283838	Knee region structure
C1283839	Entire ankle region
C1283873	Entire mid portion of circumflex branch of left coronary
C1283900	Head and neck structure
C1283901	Entire buccal region of face
C1283902	Entire submandibular area
C1284163	Entire superior border of manubrium
C1284183	Entire proximal shaft of femur
C1284254	Entire upper aerodigestive tract
C1284255	Entire respiratory region of nose
C1284256	Entire olfactory region of nose
C1284257	Entire apex of nose
C1284258	Entire bridge of nose
C1284267	Posterior wall of nasopharynx
C1284275	Laryngeal inlet
C1284282	Entire supraglottis
C1284283	Bifurcation of trachea
C1284284	Entire medial surface of lung
C1284287	Bronchopulmonary segment
C1284288	Entire hilum of right lung
C1284289	Entire subapical segment of right lower lobe of lung
C1284290	Entire hilum of left lung
C1284291	Entire superior segment of lower division of left upper lobe of lung
C1284292	Entire inferior segment of lower division of left upper lobe of lung
C1284293	Entire medial basal segment of left lower lobe of lung
C1284294	Entire subapical segment of left lower lobe of lung
C1284308	Entire surface of heart
C1284331	Suprapulmonic valve area
C1284368	Entire vermilion border of lip
C1284371	Entire tip of tongue
C1284373	Entire dorsum of tongue
C1284374	Entire pharyngeal portion of dorsum of tongue
C1284377	Entire border of tongue
C1284380	Entire inferior surface of tongue
C1284381	Sublingual Region
C1284403	Entire lateral wall of oropharynx
C1284407	Entire lower third of esophagus
C1284410	Entire lesser curvature of stomach
C1284411	Entire greater curvature of stomach
C1284412	Proximal stomach
C1284416	Entire pyloric portion of stomach
C1284423	Entire superior portion of duodenum
C1284425	Entire descending portion of duodenum
C1284429	Entire distal portion of ileum
C1284436	Entire right colon
C1284437	Entire ascending colon
C1284438	Entire transverse colon
C1284439	Entire left colon
C1284440	Entire descending colon
C1284441	Entire sigmoid colon
C1284443	Entire rectosigmoid
C1284454	Entire right lobe of liver
C1284455	Entire left lobe of liver
C1284456	Entire caudate lobe of liver
C1284458	Entire diaphragmatic aspect of liver
C1284459	Superior surface of liver
C1284460	Posterior surface of liver
C1284461	Entire visceral aspect of liver
C1284462	Entire inferior margin of liver
C1284491	Entire pelvic portion of ureter
C1284494	Entire fundus of urinary bladder
C1284495	Entire neck of urinary bladder
C1284511	Entire upper third of vagina
C1284512	Entire anterior wall of vagina
C1284513	Entire posterior wall of vagina
C1284514	Entire anterior and posterior wall of vagina
C1284515	Entire middle third of vagina
C1284516	Entire lower third of vagina
C1284517	Entire isthmus uteri
C1284531	Radix penis structure
C1284532	Entire bulb of urethra
C1284533	Entire crus penis
C1284540	Entire superior pole of testis
C1284573	Entire posterior horn of lateral ventricle
C1284574	Entire inferior horn of lateral ventricle
C1284588	Entire frontal gyrus
C1284589	Entire cortex of frontal lobe
C1284591	Entire middle frontal gyrus
C1284592	Entire inferior frontal gyrus
C1284593	Entire ascending frontal gyrus
C1284594	Entire parietal gyrus
C1284595	Entire inferior parietal lobule
C1284596	Entire occipital gyrus
C1284597	Entire cortex of occipital lobe
C1284600	Entire Brodmann areas 17 (striate cortex), 18 (parastriate cortex) and 19 (peristriate cortex) of occipital lobe
C1284605	Entire auditory projection area
C1284625	Entire anterior region of thalamus
C1284641	Entire preoptic area
C1284642	Entire supraoptic region of hypothalamus
C1284644	Entire caudal area of hypothalamus
C1284668	Entire pontine portion of corticospinal tract
C1284719	Entire accessory nerve external portion
C1284739	Entire cranial portion of parasympathetic nervous system
C1284740	Entire sacral portion of parasympathetic nervous system
C1284748	Entire anterior surface of cornea
C1284752	Entire pupillary margin of iris
C1284753	Entire ciliary margin of iris
C1284756	Structure of fundus of eye
C1284762	Entire lateral canthus
C1284763	Entire medial canthus
C1284764	Entire free margin of eyelid
C1284772	Entire spine of helix
C1284773	Entire tail of helix
C1284774	Entire auricular tubercle
C1284790	Structure of posterior mallear fold of tympanic membrane
C1284791	Structure of anterior mallear fold of tympanic membrane
C1284844	Entire side of head
C1284847	Body Regions
C1284848	Vertex
C1284849	Parietal area of head
C1284850	Occipital region
C1284851	Suboccipital region
C1284852	Temporal region
C1284853	Infratemporal region
C1284854	Auricular region
C1284856	Entire right side of face
C1284857	Entire left side of face
C1284858	Entire oral region of face
C1284859	Entire zygomatic region of face
C1284861	Infrapalpebral sulcus
C1284862	Body Regions
C1284863	Entire mental region of face
C1284864	Submental triangle structure
C1284866	Entire lower jaw region
C1284869	Dorsum sellae
C1284871	Inferior orbital margin
C1284872	Entire superior wall of orbit
C1284875	Periorbital region
C1284877	Entire laryngeal prominence
C1284878	Entire anterior portion of neck
C1284880	Entire lateral portion of neck
C1284883	Entire posterior portion of neck
C1284884	Clavicular region
C1284885	Entire supraclavicular region of neck
C1284886	Entire lateral region of trunk
C1284888	Anterior axillary line
C1284889	Posterior axillary line
C1284890	Entire upper trunk
C1284891	Lower trunk structure
C1284892	Entire right side of trunk
C1284893	Entire left side of trunk
C1284897	Entire thoracolumbar region of back
C1284899	Entire interscapular region of back
C1284901	Flank (surface region)
C1284902	Body Regions
C1284903	Sacrococcygeal Region
C1284904	Coccygeal Region
C1284905	Entire buttock
C1284908	Posterior perineum
C1284909	Entire urogenital region of perineum
C1284910	Right thorax structure
C1284911	Left thorax structure
C1284912	Posterior chest wall
C1284913	Thoracic outlet
C1284914	Body Regions
C1284915	Body Regions
C1284916	Entire lumbar part of diaphragm
C1284917	Entire upper abdomen
C1284918	Lower abdomen
C1284919	Body Regions
C1284920	Hypochondriac region
C1284942	Entire pelvic wall
C1284946	Right inguinal region
C1284947	Left iliac region
C1284951	Anterior axillary fold
C1284952	Posterior axillary fold
C1284953	Body Regions
C1284955	Deltoid region
C1284960	Antecubital region
C1284966	Dorsum of hand surface
C1284968	Thenar region surface
C1284969	Hypothenar region surface
C1284975	Entire palmar surface of thumb
C1284986	Entire dorsal surface of ring finger
C1285002	Femoral region
C1285003	Entire anterior surface of thigh
C1285004	Entire posterior surface of thigh
C1285005	Entire medial surface of thigh
C1285006	Entire lateral surface of thigh
C1285007	Popliteal region
C1285009	Entire lower leg, from knee to ankle
C1285011	Entire medial surface of lower leg
C1285013	Entire lateral surface of leg
C1285014	Entire anterior tibial compartment
C1285016	Malleolar region
C1285017	Lateral malleolar region
C1285018	Medial malleolar region
C1285019	Heels
C1285020	Heels
C1285025	Entire arch of foot
C1285026	Entire longitudinal arch of foot
C1285030	Plantar surface of great toe
C1285031	Lateral surface of great toe
C1285034	Medial surface of second toe
C1285037	Medial surface of third toe
C1285040	Medial surface of fourth toe
C1285043	Medial surface of fifth toe
C1285054	Fetal implantation site
C1285055	Entire junctional zone of implantation
C1285093	Entire surface region of pelvis
C1285095	Region of foot
C1285124	Skin of eye region (body structure)
C1285477	pole of kidney
C1285478	surface of kidney
C1285487	Structure of posterior lamella of upper eyelid
C1285488	Entire posterior lamella of upper eyelid
C1285491	Structure of anterior lamella of lower eyelid
C1285492	Structure of posterior lamella of lower eyelid
C1285493	Entire anterior lamella of lower eyelid
C1285494	Entire posterior lamella of lower eyelid
C1285518	Entire orbit proper
C1288302	Entire dermatoglyphic patterns of sole
C1288303	Entire dermatoglyphic patterns of palm
C1288306	Skin structure of eyebrow
C1288312	Structure of trochanteric section of femur
C1288319	Structure of posterior nasopharynx
C1288320	Structure of lateral nasopharynx
C1288321	Structure of anterior nasopharynx
C1288322	Structure of superior nasopharynx
C1288323	Structure of roof of nasopharynx
C1288324	Structure of myocardium of inferior surface of left ventricle
C1288326	Structure of caudal one third of stomach
C1288328	Structure of dome of urinary bladder
C1288355	Entire hemorrhoidal zone
C1288357	Entire cloacogenic area of rectum
C1288406	Entire posterior border of testis
C1288423	Entire dorsum of penis
C1288425	Entire urethral aspect of penis
C1288447	Entire sternal region
C1288448	Structure of costal arch
C1288465	Entire superior articular process of first thoracic vertebra
C1288466	Entire superior articular process of second thoracic vertebra
C1288467	Entire superior articular process of third thoracic vertebra
C1288468	Entire superior articular process of fourth thoracic vertebra
C1288469	Entire superior articular process of fifth thoracic vertebra
C1288470	Entire superior articular process of sixth thoracic vertebra
C1288471	Entire superior articular process of seventh thoracic vertebra
C1288472	Entire inferior articular process of eighth thoracic vertebra
C1288473	Entire superior articular process of ninth thoracic vertebra
C1288474	Entire superior articular process of tenth thoracic vertebra
C1288475	Entire superior articular process of eleventh thoracic vertebra
C1288476	Entire superior articular process of twelfth thoracic vertebra
C1288477	Entire superior articular process of thoracic vertebra
C1288478	Entire inferior articular process of first thoracic vertebra
C1288479	Entire inferior articular process of second thoracic vertebra
C1288480	Entire inferior articular process of third thoracic vertebra
C1288481	Entire inferior articular process of fourth thoracic vertebra
C1288482	Entire inferior articular process of fifth thoracic vertebra
C1288483	Entire inferior articular process of sixth thoracic vertebra
C1288484	Entire inferior articular process of seventh thoracic vertebra
C1288485	Entire superior articular process of eighth thoracic vertebra
C1288486	Entire inferior articular process of ninth thoracic vertebra
C1288487	Entire inferior articular process of tenth thoracic vertebra
C1288488	Entire inferior articular process of eleventh thoracic vertebra
C1288489	Entire inferior articular process of twelfth thoracic vertebra
C1288490	Entire inferior articular process of thoracic vertebra
C1288491	Entire articular process of first thoracic vertebra
C1288492	Entire articular process of second thoracic vertebra
C1288493	Entire articular process of third thoracic vertebra
C1288494	Entire articular process of fourth thoracic vertebra
C1288495	Entire articular process of fifth thoracic vertebra
C1288496	Entire articular process of sixth thoracic vertebra
C1288497	Entire articular process of seventh thoracic vertebra
C1288498	Entire articular process of eighth thoracic vertebra
C1288499	Entire articular process of ninth thoracic vertebra
C1288500	Entire articular process of tenth thoracic vertebra
C1288501	Entire articular process of eleventh thoracic vertebra
C1288502	Entire articular process of twelfth thoracic vertebra
C1288503	Entire articular process of thoracic vertebra
C1288560	Entire anterior surface of manubrium
C1288561	Entire posterior surface of manubrium
C1288562	Entire clavicular notch of sternum
C1288563	Entire inferior border of manubrium
C1288564	Entire lateral border of manubrium
C1288565	Entire anterior surface of body of sternum
C1288566	Entire posterior surface of body of sternum
C1288567	Structure of lateral border of body of sternum
C1288572	Entire articular part of tubercle of third rib
C1288573	Entire non-articular part of tubercle of third rib
C1288574	Entire articular part of tubercle of rib
C1288575	Entire non-articular part of tubercle of rib
C1288577	Structure of upper border of rib
C1288578	Structure of under border of rib
C1288579	Structure of outer surface of rib
C1288580	Structure of inner surface of rib
C1288585	Entire costal part of diaphragm
C1288586	Entire sternal part of diaphragm
C1288607	Structure of parovarian region
C1288610	Entire lateral abdominal wall
C1288616	Entire femoral fossa
C1288618	Entire lateral inguinal fossa
C1288619	Entire right inguinal triangle
C1288620	Entire left inguinal triangle
C1288635	Entire femoral ring
C1288637	Entire mid thigh region
C1288638	Entire above knee region
C1288639	Entire right shoulder region
C1288640	Entire left shoulder region
C1288641	Entire right femoral region
C1288642	Entire left femoral region
C1288647	Entire dorsum of nose
C1288664	Entire posterior cubital region
C1288665	Entire lateral cubital region
C1288666	Entire medial cubital region
C1288675	Entire articular circumference of ulna
C1288706	Entire medial border of scapula
C1288708	Entire costal aspect of scapula
C1288709	Entire dorsal aspect of scapula
C1288737	Entire radial notch of ulna
C1288738	Entire ulnar notch of radius
C1288739	Entire carpal articular surface of radius
C1288740	Entire bone of forearm
C1288741	Entire right forearm
C1288742	Entire left forearm
C1288749	Entire anterior carpal region
C1288750	Entire posterior carpal region
C1288751	Entire right wrist
C1288752	Entire left wrist
C1288777	Entire lateral nail fold
C1288814	Entire tuberosity of distal phalanx of index finger
C1288815	Entire base of phalanx of index finger
C1288816	Entire shaft of phalanx of index finger
C1288817	Entire head of phalanx of index finger
C1288818	Entire articular surface, metacarpal, of phalanx of index finger
C1288819	Entire articular surface, interphalangeal, of phalanx of index finger
C1288821	Entire articular surface, phalanges, of second metacarpal bone
C1288829	Entire tuberosity of distal phalanx of middle finger
C1288830	Entire base of phalanx of middle finger
C1288831	Entire shaft of phalanx of middle finger
C1288832	Entire head of phalanx of middle finger
C1288833	Entire articular surface, metacarpal, of phalanx of middle finger
C1288834	Entire articular surface, interphalangeal, of phalanx of middle finger
C1288843	Entire tuberosity of distal phalanx of ring finger
C1288844	Entire base of phalanx of ring finger
C1288845	Entire shaft of phalanx of ring finger
C1288846	Entire head of phalanx of ring finger
C1288847	Entire articular surface, metacarpal, of phalanx of ring finger
C1288848	Entire articular surface, interphalangeal, of phalanx of ring finger
C1288849	Entire capsule of metacarpophalangeal joint of ring finger
C1288850	Entire capsule of proximal interphalangeal joint of ring finger
C1288851	Entire capsule of distal interphalangeal joint of ring finger
C1288857	Entire tuberosity of distal phalanx of little finger
C1288858	Entire base of phalanx of little finger
C1288859	Entire shaft of phalanx of little finger
C1288860	Entire head of phalanx of little finger
C1288861	Entire articular surface, metacarpal, of phalanx of little finger
C1288862	Entire articular surface, interphalangeal, of phalanx of little finger
C1288879	Entire proximal nail fold
C1288888	Entire articular surface, interphalangeal, of phalanx of thumb
C1288889	Entire articular surface, metacarpal, of phalanx of thumb
C1288890	Entire tuberosity of distal phalanx of thumb
C1288920	Entire articular surface, metacarpal, of phalanx of hand
C1288921	Entire articular surface, interphalangeal, of phalanx of hand
C1288923	Entire articular surface, first metacarpal, of second metacarpal bone
C1288924	Entire articular surface, trapezoid, of second metacarpal bone
C1288925	Entire articular surface, third metacarpal, of second metacarpal bone
C1288926	Entire articular surface, second metacarpal, of third metacarpal bone
C1288927	Entire articular surface, capitate, of third metacarpal bone
C1288928	Entire articular surface, fourth metacarpal, of third metacarpal bone
C1288929	Entire articular surface, phalanges, of third metacarpal bone
C1288930	Entire styloid process of third metacarpal bone
C1288931	Entire articular surface, third metacarpal, of fourth metacarpal bone
C1288932	Entire articular surface, capitate, of fourth metacarpal bone
C1288933	Entire articular surface, hamate, of fourth metacarpal bone
C1288934	Entire articular surface, fifth metacarpal, of fourth metacarpal bone
C1288935	Entire articular surface, phalanges, of fourth metacarpal bone
C1288936	Entire articular surface, fourth metacarpal, of fifth metacarpal bone
C1288937	Entire articular surface, hamate, of fifth metacarpal bone
C1288938	Entire articular surface, phalanges, of fifth metacarpal bone
C1288939	Entire articular surface, trapezoid, of first metacarpal bone
C1288940	Entire articular surface, second metacarpal, of first metacarpal bone
C1288941	Entire articular surface, phalanges, of first metacarpal bone
C1289017	Structure of suprasellar region
C1289018	Entire supratentorial region of cranial cavity
C1289019	Entire infratentorial region of cranial cavity
C1289020	Structure of infraorbital region of face
C1289021	Entire right upper eyelid
C1289022	Entire right lower eyelid
C1289035	Entire right margin of tongue
C1289043	Entire left upper eyelid
C1289044	Entire left lower eyelid
C1289057	Entire left margin of tongue
C1289110	Structure of anterior mallear fold of tympanic membrane
C1289111	Structure of posterior mallear fold of tympanic membrane
C1289115	Entire fold of chorda tympani
C1289118	Entire fold for stapes
C1289132	Entire infraauricular region
C1289145	Entire nasopharyngeal surface of soft palate
C1289158	Entire contact surface of tooth
C1289171	Entire vestibule of mouth
C1289172	Entire oral cavity proper
C1289173	Entire retromaxillary region
C1289174	Entire lateral surface of sublingual gland
C1289175	Entire medial surface of sublingual gland
C1289181	Entire dorsum of anterior tongue
C1289185	Entire dorsum of tip of tongue
C1289186	Dorsal part of oral part of tongue
C1289187	Entire dorsal surface of base of tongue
C1289210	Entire center of face
C1289211	Entire lateral aspect of face
C1289222	Entire superior tarsal plate
C1289223	Entire inferior tarsal plate
C1289232	Entire inferior tarsal muscle
C1289234	Entire anterior aspect of eyelids
C1289235	Entire posterior aspect of eyelids
C1289241	Entire lacrimal fold
C1289303	Entire infraorbital margin of maxilla
C1289304	Entire retroorbital region
C1289326	Entire roof of nose
C1289333	Entire posterior margin of nasal septum
C1289336	Entire nasal portion of nasopharynx
C1289371	Entire fold for incus
C1289382	Entire roof of mastoid antrum
C1289402	Entire area nervi facialis of internal auditory canal
C1289403	Entire area cochleae of internal auditory canal
C1289404	Entire superior vestibular area of internal auditory canal
C1289405	Entire inferior vestibular area of internal auditory canal
C1289525	Entire piriform area
C1289527	Entire transentorhinal zone
C1289529	Structure of olfactory trigone
C1289537	Entire anterior parolfactory area
C1289538	Entire posterior parolfactory area
C1289540	Entire septal area of paraterminal body of rhinencephalon
C1289541	Superior wall of nasopharynx
C1289545	Entire fornix of hypothalamus
C1289556	Entire lateral preoptic nucleus
C1289557	Entire supraoptic nucleus
C1289558	Entire paraventricular nucleus
C1289559	Entire suprachiasmatic nucleus
C1289560	Entire anterior hypothalamic nucleus
C1289561	Entire dorsomedial hypothalamic nucleus
C1289562	Entire supraoptic hypophyseal tract
C1289568	Entire medial mammillary nucleus
C1289570	Entire lateral mammillary nucleus
C1289571	Entire supramammillary nucleus
C1289574	Entire posterior hypothalamic nucleus
C1289575	Entire supramammillary decussation
C1289577	Entire transverse peduncular tract nucleus
C1289579	Entire median forebrain bundle
C1289584	Entire distal part of pituitary
C1289587	Entire anterior tubercle of thalamus
C1289590	Entire paraventricular nucleus of thalamus
C1289592	Entire periventricular gray matter of thalamus
C1289598	Entire ventral posterolateral nucleus of thalamus
C1289599	Entire ventral posteromedial nucleus of thalamus
C1289600	Entire ventral posterior inferior nucleus
C1289601	Entire ventral lateral nucleus of thalamus
C1289602	Entire posterior tubercle of thalamus
C1289603	Entire medial part of pulvinar
C1289604	Entire lateral part of pulvinar
C1289605	Entire inferior part of pulvinar
C1289606	Entire external medullary lamina of thalamus
C1289607	Entire suprageniculate nucleus
C1289609	Entire inferior brachium of corpora quadrigemina
C1289611	Entire prerubral area
C1289626	Entire lateral medullary lamina
C1289627	Entire medial medullary lamina
C1289628	Entire frontopontine tract of internal capsule
C1289631	Entire posterior thalamic radiation of internal capsule
C1289633	Entire superior thalamic radiation of internal capsule
C1289638	Entire posterior parietal gyrus
C1289640	Entire lateral occipital gyrus
C1289641	Entire lateral occipital sulcus
C1289645	Entire frontoparietal operculum
C1289647	Entire longitudinal cerebral fissure
C1289648	Entire fissure of Sylvius
C1289652	Entire collateral eminence
C1289653	Entire supracallosal gyrus
C1304899	Structure of sternal end of clavicle
C1304900	Structure of acromial end of clavicle
C1304901	Structure of proximal epiphysis of radius
C1305139	Entire base of heart
C1305140	Entire sternocostal surface of heart
C1305141	Entire diaphragmatic surface of heart
C1305142	Entire left margin of heart
