cui	definition
C0446942	Entire apical segment of right lower lobe of lung
C0446943	Entire anterior basal segment of right lower lobe of lung
C0446944	Entire medial basal segment of right lower lobe of lung
C0446946	Entire posterior basal segment of right lower lobe of lung
C0446948	Entire apicoposterior segment of upper division of left upper lobe of lung
C0446950	Entire anterior segment of upper division of left upper lobe of lung
C0446955	Entire superior segment of left lower lobe of lung
C0446956	Entire anterior basal segment of left lower lobe of lung
C0446957	Entire posterior basal segment of left lower lobe of lung
C0446982	Entire subvalvular aortic region
C0447210	Entire maxillary teeth
C0447211	Entire mandibular teeth
C0447301	Tooth surface
C0447303	Occlusal surface of tooth
C0447304	Entire incisal border of tooth
C0447309	Entire vestibular surface of tooth
C0447415	Entire lower alveolar ridge
C0447442	Entire free surface of gingiva
C0447510	Structure of pyloric portion of stomach
C0447520	Region of large intestine
C0447529	Pectinate line of anal canal
C0447583	lateral wall of bladder
C0447586	Trigone of bladder
C0447606	Entire right side of vulva
C0447607	Entire left side of vulva
C0448009	Entire symphysis of mandible
C0448038	Entire proximal shaft of humerus
C0448039	Entire midshaft of humerus
C0448041	Entire supracondylar part of humerus
C0448179	Lip of acetabulum
C0448214	Entire upper end of tibia
C0448218	Entire lower end of tibia
C0448226	Entire lower end of fibula
C0448784	Entire vertex region of scalp (body structure)
C0449197	PUL anatomical site notation for tumour staging
C0449198	HEP tumour staging notation
C0449200	Anatomical site notation for tumour staging PLE
C0449201	PER tumor staging notation
C0449203	PEL tumor staging notation
C0449204	HEA tumor staging notation
C0449205	LIM tumor staging site
C0449206	OSS tumor staging notations
C0449207	ADR body location
C0449208	THO tumor staging notation
C0449209	ORB tumour staging notation
C0449210	Body Regions
C0450465	Lung acupuncture point LU1
C0450477	Large intestine acupuncture LI1
C0450478	Large intestine acupuncture point LI2
C0450479	Large intestine acupuncture point LI3
C0450480	LI4 Acupuncture Point
C0450481	Large intestine acupuncture point LI5
C0450498	Stomach acupuncture point ST1
C0450499	Stomach acupuncture point ST2
C0450500	Stomach acupuncture point ST3
C0450501	Stomach acupuncture point ST4
C0450502	ST5 Acupuncture Point
C0450503	ST6 Acupuncture Point
C0450504	ST7 Stomach acupuncture point
C0450505	Stomach acupuncture point ST8
C0450508	Stomach acupuncture point ST11
C0450509	Stomach acupuncture point ST12
C0450510	Stomach acupuncture point ST13
C0450511	ST14 (body structure)
C0450512	Stomach acupuncture point ST15
C0450513	ST16 Stomach acupuncture point
C0450514	Stomach acupuncture point ST17
C0450515	ST18 - stomach acupuncture point
C0450516	Stomach acupuncture point ST19
C0450517	ST20 - stomach acupuncture point
C0450519	ST22 Stomach Acupuncture Point
C0450535	ST38 (body structure)
C0450544	Spleen acupuncture point SP1
C0450545	Spleen acupuncture point SP2
C0450546	Spleen acupuncture point SP4
C0450547	Spleen acupuncture point SP5
C0450548	Spleen acupuncture point SP6
C0450549	SP7 (accupuncture point)
C0450550	Spleen acupuncture point SP8
C0450551	SP9 - spleen acupuncture point
C0450559	Spleen acupuncture point SP17
C0450596	BL2 Bladder acupuncture point
C0450605	BL11 Bladder Acupuncture Point
C0450616	BL22 bladder acupuncture point
C0450628	BL34 (body structure)
C0450689	Pericardium acupuncture point PC1
C0450690	Pericardium acupuncture point PC2
C0450691	PC3 Pericardium acupuncture point
C0450692	PC4 Pericardium acupuncture point
C0450693	Pericardium acupuncture point PC5
C0450694	Pericardium acupuncture point PC6
C0450695	Pericardium acupuncture point PC7
C0450696	Pericardium acupuncture point PC8
C0450697	Pericardium acupuncture point PC9
C0450698	Triple energizer acupuncture point TE1
C0450699	Triple energizer acupuncture point TE2
C0450700	Triple energizer acupuncture point TE3
C0450723	Gallbladder acupuncture point GB2
C0450724	Gallbladder acupuncture point 3
C0450726	Gallbladder acupuncture points GB5
C0450734	Gallbladder acupuncture points GB14
C0450768	Liver acupuncture point LR3
C0450773	Liver acupuncture point LR8
C0450776	Liver acupuncture point LR11
C0450811	CV2 (body structure)
C0450813	CV4 Acupuncture Point
C0456956	Structure of low right atrium
C0457847	Segment of thoracic spinal cord
C0457848	Lumbar segment of spinal cord
C0457906	Surface of knee
C0457907	Structure of surface region of ankle
C0458328	periamygdaloid area
C0458343	Trigger point
C0458345	Structure of parasternal region
C0458359	Premotor area
C0458361	somatosensory areas
C0458396	Cerebellar lobe
C0458398	Entire pole of kidney
C0458399	surface of kidney
C0458403	Entire layer of kidney
C0458414	Entire abdominal portion of ureter
C0458440	Entire plica interureterica
C0458544	Entire base of arytenoid cartilage
C0458546	Entire apex of arytenoid cartilage
C0458561	External nose structure
C0458618	Entire anterior border of testis
C0458619	Entire medial aspect of testis
C0458620	Entire lateral aspect of testis
C0458628	Triangular fossa of antihelix
C0458629	Scaphoid fossa
C0458638	Entire wall of vas deferens
C0458680	Seminal vesicle wall
C0458697	Structure of internal glandular zone of prostate
C0458872	Entire wall of Fallopian tube
C0458878	Entire lateral aspect of ovary
C0458879	Entire medial aspect of ovary
C0458892	Male perineal structure
C0458923	Superior surface of liver
C0458924	Entire anterior portion of diaphragmatic aspect of liver
C0458925	Posterior surface of liver
C0458926	Right Surface of the Liver
C0458927	Inferior surface of liver
C0458928	Diaphragmatic surface of liver
C0458930	Border of liver
C0458947	Female perineal structure
C0459086	Entire cochlear promontory of tympanic cavity
C0459094	Entire proximal shaft of tibia
C0459549	Entire segment of eyeball
C0459551	Optic axis
C0459566	Entire bony orbit
C0459567	Entire supraorbital margin
C0459570	Inferior orbital margin
C0460004	Head and neck structure
C0460005	Body Regions
C0460009	Back structure, including back of neck
C0460025	Upper jaw region
C0460026	Lower jaw region
C0475424	Entire cervical esophagus
C0475425	Entire thoracic esophagus
C0502383	Interlobar bronchus
C0502462	Crest of head of rib (region)
C0502472	Structure of upper border of rib
C0503895	Anatomical conduit
C0504592	Entire body wall
C0505385	Level of the fourth thoracic vertebra
C0521367	Oropharyngeal
C0521401	Leptomeningeal
C0521408	Structure of transentorhinal zone
C0521443	Structure of lateral abdominal wall
C0521449	Cytoplasmic
C0521453	Decidual
C0521454	Chorionic
C0521458	Ectodermal
C0524466	Intracranial
C0524467	Structure of costovertebral angle of twelfth rib
C0524468	Structure of right shoulder region
C0524469	Structure of left shoulder region
C0524470	Entire right hip region
C0524471	Structure of left hip
C0542561	BL19 Bladder Acupuncture Point
C0545525	Upper inner quadrant of breast
C0545526	Lower inner quadrant of breast
C0545527	Upper outer quadrant of breast
C0545528	Lower outer quadrant of breast
C0549224	Frontal region
C0553534	Cardiopulmonary
C0556956	Region of neck (body structure)
C0558302	Sublingual location
C0580756	Anterior surface of cornea
C0581490	Oral frenum
C0581758	Nuchal region
C0582240	Structure of costal arch
C0582492	Entire proximal end of ulna
C0584227	Ethmoid sinus uncinate process
C0589384	Transvesical Location
C0589385	Transgastric Location
C0589395	Transorbital Location
C0589466	Transsplenic Location
C0596790	Body Regions
C0598032	septal area
C0599720	Brodmann area
C0682660	gustatory area of cortex
C0687007	Structure of under border of rib
C0687008	Structure of outer surface of rib
C0687009	Structure of inner surface of rib
C0687010	Structure of upper border of first rib
C0687011	Structure of under border of first rib
C0687012	Structure of outer surface of first rib
C0687013	Structure of inner surface of first rib
C0687014	Structure of upper border of second rib
C0687015	Structure of under border of second rib
C0687016	Structure of outer surface of second rib
C0687017	Structure of inner surface of second rib
C0687022	Structure of articular surface, phalanges, of second metacarpal bone
C0687029	Structure of laryngeal aspect of aryepiglottic fold
C0687030	Structure of hypopharyngeal aspect of interarytenoid fold
C0687031	Structure of laryngeal aspect of interarytenoid fold
C0687082	Proboscis
C0694598	CA1 field
C0700042	Orbital region
C0700375	Perianal surface region
C0728992	Body Regions
C0729841	Posterior meatal wall of external auditory canal
C0730133	Entire base of patella
C0730134	Entire subcapital section of head of femur
C0730135	Entire base of neck of femur
C0733975	Segment of large intestine
C0738563	Entire subregion of abdomen
C0738779	Structure of peritoneal fold
C0739153	Ovarian fossa (region)
C0816451	Surface of subscapular fossa
C0816455	Glenoid cavity region of right scapula
C0816456	Glenoid cavity region of left scapula
C0816700	Anterior surface of shaft of ulna
C0816701	Posterior surface of shaft of ulna
C0816703	Interosseous border of diaphysis of ulna
C0816704	Anterior border of diaphysis of ulna
C0816705	Posterior border of diaphysis of ulna
C0816951	Body Regions
C0817096	Body Regions
C0817662	Palm of hand
C0817743	Region of trunk
C0817911	Surface of buttock
C0818078	Plantar surface
C0826683	Articular surface of medial cuneiform bone for second metatarsal bone
C0826690	Navicular surface of medial cuneiform bone
C0826698	First metatarsal surface of medial cuneiform bone
C0826768	Navicular surface of intermediate cuneiform bone
C0826867	Articular surface of lateral cuneiform bone for second metatarsal bone
C0826879	Navicular surface of lateral cuneiform bone
C0826889	Articular surface of lateral cuneiform bone for fourth metatarsal bone
C0826942	Lateral cuneiform facet of right cuboid bone
C0826943	Articular surface of left cuboid bone for lateral cuneiform bone
C0826951	Articular surface of cuboid bone for fourth metatarsal bone
C0826954	Articular surface of cuboid bone for fifth metatarsal bone
C0827124	Acromial part of right shoulder
C0827125	Acromial part of left shoulder
C0830890	Interosseous border of ulna
C0834632	Malleolar groove of fibula
C0834633	Malleolar fossa of fibula
C0920882	Region of neck (body structure)
C0921044	Frontal part of head
C0923870	Anatomical location
C0923872	Anatomical attachment
C0925111	Myocardium of atrium proper
C0925588	Maxillary surface of sphenoid
C0926407	Lambda (Sutural junction)
C0926703	Pterion
C0927233	Segment of brain
C0930456	Right nasal vestibule
C0930457	Left nasal vestibule
C0930569	Lower vermilion
C0931849	Body Regions
C0931905	Submental triangle structure
C0934419	Bregma
C0934420	Cephalometric nasion point
C0934569	Hemithoracic structure
C0935456	Temple
C0935598	Sagittal plane
C0935623	anatomical pole
C1176460	Structure of surface region of ankle
C1179687	T1 innervation
C1179688	T2 innervation
C1179689	T5 innervation
C1179690	T6 innervation
C1179692	T8 innervation
C1179693	T9 innervation
C1179694	T10 - Thoracic segmental innervation
C1179695	T11 innervation
C1179696	T12 Thoracic segmental innervation
C1179698	L1 innervation
C1179699	L2 innervation
C1179700	L3 innervation
C1179701	L4 Segmental Innervation
C1179702	L5 Segmental Innervation
C1179704	S1 innervation
C1179705	S2 innervation
C1179706	S3 (sacral segmental innervation)
C1179707	S4 innervation
C1179708	S5 innervation
C1183739	Right atrium proper
C1183952	Inner cortex of kidney
C1184175	Right cheek proper
C1184176	Left cheek proper
C1184350	Acromial part of right pectoral girdle
C1184351	Acromial part of left pectoral girdle
C1184526	Anterior border of ulna
C1184527	Posterior border of ulna
C1184553	Margo medialis
C1184554	Margo inferior
C1184569	Anterior surface of ulna
C1184570	Posterior surface of ulna
C1184682	Maxillary surface of sphenoid
C1184888	Basion
C1184889	Opisthion
C1184914	Mandibular torus
C1185729	Cusp (anatomic)
C1185788	Neck of glans
C1185789	Septum of glans
C1186019	Vascular layer of testis
C1235676	Tuber Subdivision of Bone
C1253941	Surface of tongue
C1254044	Knee region structure
C1261097	Structure of posterior extremity of spleen
C1261192	Ankle region
C1261193	Body Regions
C1266932	Entire right lateral border of body of sternum
C1266933	Entire left lateral border of body of sternum
C1266943	Entire articular part of tubercle of first rib
C1266944	Entire non-articular part of tubercle of first rib
C1266945	Entire angle of first rib
C1266948	Structure of upper border of first rib
C1266949	Structure of under border of first rib
C1266950	Structure of outer surface of first rib
C1266951	Structure of inner surface of first rib
C1266952	Entire crest of head of second rib
C1266954	Entire articular part of tubercle of second rib
C1266955	Entire non-articular part of tubercle of second rib
C1266956	Entire angle of second rib
C1266959	Structure of upper border of second rib
C1266960	Structure of under border of second rib
C1266961	Structure of outer surface of second rib
C1266962	Structure of inner surface of second rib
C1266963	Entire crest of head of third rib
C1266965	Entire angle of third rib
C1266968	Structure of upper border of third rib
C1266969	Structure of under border of third rib
C1266970	Structure of outer surface of third rib
C1266971	Structure of inner surface of third rib
C1266972	Entire crest of head of fourth rib
C1266974	Entire articular part of tubercle of fourth rib
C1266975	Entire non-articular part of tubercle of fourth rib
C1266976	Entire angle of fourth rib
C1266979	Structure of upper border of fourth rib
C1266980	Structure of under border of fourth rib
C1266981	Structure of outer surface of fourth rib
C1266982	Structure of inner surface of fourth rib
C1266983	Entire crest of head of fifth rib
C1266985	Entire articular part of tubercle of fifth rib
C1266986	Entire non-articular part of tubercle of fifth rib
C1266987	Entire angle of fifth rib
C1266990	Structure of upper border of fifth rib
C1266991	Structure of under border of fifth rib
C1266992	Structure of outer surface of fifth rib
C1266993	Structure of inner surface of fifth rib
C1266994	Entire crest of head of sixth rib
C1266996	Entire articular part of tubercle of sixth rib
C1266997	Entire non-articular part of tubercle of sixth rib
C1266998	Entire angle of sixth rib
C1267001	Structure of upper border of sixth rib
C1267002	Structure of under border of sixth rib
C1267003	Structure of outer surface of sixth rib
C1267004	Structure of inner surface of sixth rib
C1267005	Entire crest of head of seventh rib
C1267007	Entire articular part of tubercle of seventh rib
C1267008	Entire non-articular part of tubercle of seventh rib
C1267009	Entire angle of seventh rib
C1267012	Structure of upper border of seventh rib
C1267013	Structure of under border of seventh rib
C1267014	Structure of outer surface of seventh rib
C1267015	Structure of inner surface of seventh rib
C1267016	Entire crest of head of eighth rib
C1267018	Entire articular part of tubercle of eighth rib
C1267019	Entire non-articular part of tubercle of eighth rib
C1267020	Entire angle of eighth rib
C1267023	Structure of upper border of eighth rib
C1267024	Structure of under border of eighth rib
C1267025	Structure of outer surface of eighth rib
C1267026	Structure of inner surface of eighth rib
C1267027	Entire crest of head of ninth rib
C1267029	Entire articular part of tubercle of ninth rib
C1267030	Entire non-articular part of tubercle of ninth rib
C1267031	Entire angle of ninth rib
C1267034	Structure of upper border of ninth rib
C1267035	Structure of under border of ninth rib
C1267036	Structure of outer surface of ninth rib
C1267037	Structure of inner surface of ninth rib
C1267040	Entire articular part of tubercle of tenth rib
C1267041	Entire non-articular part of tubercle of tenth rib
C1267042	Entire angle of tenth rib
C1267045	Structure of upper border of tenth rib
C1267046	Structure of under border of tenth rib
C1267047	Structure of outer surface of tenth rib
C1267048	Structure of inner surface of tenth rib
C1267053	Entire angle of eleventh rib
C1267056	Structure of upper border of eleventh rib
C1267057	Structure of under border of eleventh rib
C1267058	Structure of outer surface of eleventh rib
C1267059	Structure of inner surface of eleventh rib
C1267064	Entire angle of twelfth rib
C1267067	Structure of upper border of twelfth rib
C1267068	Structure of under border of twelfth rib
C1267069	Structure of outer surface of twelfth rib
C1267070	Structure of inner surface of twelfth rib
C1267115	Synchondrosis structure
C1267214	Entire root of nose
C1267547	Oral region
C1267582	Proximal stomach
C1267662	Entire right margin of uterus
C1267663	Entire left margin of uterus
C1268222	Body surface region
C1268224	Region of hand (body structure)
C1268233	Entire right hip region
C1268234	Structure of left hip
C1268991	Entire upper inner quadrant of breast
C1268992	Entire upper outer quadrant of breast
C1268993	Entire lower inner quadrant of breast
C1268994	Entire lower outer quadrant of breast
C1269551	Entire roof of nasopharynx
C1269615	Entire proximal end of humerus
C1269871	Entire lumbar spine
C1272506	Entire Brodmann area 43, subcentral
C1272523	Brodmann area 1
C1272524	Entire Brodmann area 2, caudal postcentral
C1272525	Entire Brodmann area 3, rostral postcentral
C1272527	Brodmann area 5
C1272530	Entire Brodmann area 8, intermediate frontal
C1272532	Brodmann area 10
C1272540	Entire Brodmann area 22, superior temporal
C1273020	Entire jaw region
C1275509	Supraorbital area structure
C1275510	Postauricular region structure
C1275511	Preauricular region structure
C1275631	Anal part of perineum
C1276227	region of kidney
C1276978	Suture line of skin
C1277334	Entire inferior border of parietal bone
C1277591	Entire lateral part of occipital bone
C1277604	Structure of tuberculum sellae
C1277625	Entire middle clinoid process
C1277628	Entire posterior clinoid process
C1277631	Entire anterior clinoid process
C1278224	Entire suprahyoid region
C1278246	Entire junctional region with oropharynx
C1278546	Entire fold of laryngeal nerve
C1278562	Entire salpingopharyngeal fold
C1278595	Entire nucleus pulposus of intervertebral disc of third cervical vertebra
C1278596	Entire anulus fibrosus of intervertebral disc of third cervical vertebra
C1278597	Entire nucleus pulposus of intervertebral disc of fourth cervical vertebra
C1278598	Entire anulus fibrosus of intervertebral disc of fourth cervical vertebra
C1278599	Entire nucleus pulposus of intervertebral disc of fifth cervical vertebra
C1278600	Entire anulus fibrosus of intervertebral disc of fifth cervical vertebra
C1278601	Entire nucleus pulposus of intervertebral disc of sixth cervical vertebra
C1278602	Entire anulus fibrosus of intervertebral disc of sixth cerebral vertebra
C1278604	Entire nucleus pulposus of intervertebral disc of cervical vertebra
C1278615	Entire superior articular process of third cervical vertebra
C1278616	Entire inferior articular process of third cervical vertebra
C1278617	Entire articular process of third cervical vertebra
C1278618	Entire superior articular process of fourth cervical vertebra
C1278619	Entire inferior articular process of fourth cervical vertebra
C1278620	Entire articular process of fourth cervical vertebra
C1278621	Entire superior articular process of fifth cervical vertebra
C1278622	Entire inferior articular process of fifth cervical vertebra
C1278623	Entire articular process of fifth cervical vertebra
C1278624	Entire superior articular process of sixth cervical vertebra
C1278627	Entire inferior articular process of sixth cervical vertebra
C1278628	Entire articular process of sixth cervical vertebra
C1278629	Entire superior articular process of seventh cervical vertebra
C1278630	Entire inferior articular process of seventh cervical vertebra
C1278631	Entire articular process of seventh cervical vertebra
C1278632	Entire arch of cervical vertebra
C1278633	Entire superior articular process of axis
C1278634	Entire inferior articular process of axis
C1278635	Entire articular process of axis
C1278639	Entire superior belly of omohyoid muscle
C1278640	Entire inferior belly of omohyoid muscle
C1278641	Entire straight part of longus colli muscle
C1278642	Entire superior oblique part of longus colli muscle
C1278643	Entire inferior oblique part of longus colli muscle
C1278664	Entire sternocleidomastoid region of neck
C1278665	Entire scalene region of neck
C1278666	Entire carotid triangle
C1278669	Right lateral part of neck
C1278672	Left lateral part of neck
C1278676	Entire anterior epiglottis
C1278677	Entire posterior epiglottis
C1278733	Entire lateral wall of hypopharynx
C1278736	Entire upper cervical spinal cord
C1278738	Entire lower cervical spinal cord
C1278742	Entire apex of cervical spinal cord posterior horn
C1278744	Entire substantia gelatinosa of cervical spinal cord posterior horn
C1278749	Entire cervical spinal cord white matter
C1278750	Entire anterior cervical spinal cord nerve root
C1278751	Entire posterior cervical spinal cord nerve root
C1278809	Entire superior wall of nasopharynx
C1278813	Entire lateral pharyngeal wall
C1278828	Entire peripharyngeal area
C1278831	Clavicular region (surface region)
C1278849	Infraclavicular region structure
C1278884	Entire orbital region
C1278885	Structure of canthus
C1278910	Entire oral cavity
C1278941	Entire apex of right lung
C1278979	Structure of base of right lung
C1279043	Entire perihilar region of right lung
C1279066	Entire superior articular facet of atlas
C1279067	Entire inferior articular facet of atlas
C1279149	Entire surface region of elbow
C1279151	Entire groin (surface region)
C1279152	Entire back of head
C1279156	Entire sacral region
C1279158	Pubic region
C1279206	Entire apex of left lung
C1279207	Structure of base of left lung
C1279208	Entire root of left lung
C1279214	Entire perihilar region of left lung
C1279286	Entire intervenous tubercle of right atrium
C1279287	Entire supratricuspid valve area
C1279298	Entire supramitral valve area
C1279407	Entire preductal region of aortic arch
C1279408	Entire postductal region of aortic arch
C1279410	Entire juxtaductal region of aortic arch
C1279442	Entire costal surface of lung
C1279443	Entire vertebral part of medial surface of lung
C1279444	Entire mediastinal part of medial surface of lung
C1279445	Entire cardiac impression of medial surface of lung
C1279447	Entire diaphragmatic surface of lung
C1279448	Entire interlobar surfaces of lung
C1279449	Entire anterior margin of lung
C1279450	Entire inferior margin of lung
C1279451	Entire perihilar region of lung
C1279455	Entire lung parenchyma
C1279478	Entire right axillary region
C1279479	Entire left axillary region
C1279491	Entire mammary region
C1279499	Structure of substernal region
C1279539	Entire midcervical section of neck of femur
C1279562	Entire falciform margin of saphenous opening
C1279597	Entire below knee region
C1279615	Entire malleolar articular surface of tibia
C1279640	Structure of cuboidal articular surface of calcaneus
C1279650	Entire ball of foot
C1279654	Entire transverse arch of foot
C1279717	Entire articular surface, metatarsal, of phalanx of great toe
C1279718	Entire articular surface, interphalangeal, of phalanx of great toe
C1279824	Entire articular surface, metatarsal, of phalanx of second toe
C1279826	Entire articular surface, interphalangeal, of phalanx of second toe
C1279833	Entire articular surface, metatarsal, of phalanx of third toe
C1279834	Entire articular surface, interphalangeal, of phalanx of third toe
C1279839	Entire articular surface, metatarsal, of phalanx of fourth toe
C1279841	Entire articular surface, interphalangeal, of phalanx of fourth toe
C1279847	Entire articular surface, metatarsal, of phalanx of fifth toe
C1279848	Entire articular surface, interphalangeal, of phalanx of fifth toe
C1279861	Lower trunk (surface region)
C1279862	Entire shoulder girdle
C1279863	Upper trunk (surface region)
C1279954	Entire articular surface, metatarsal, of phalanx of foot
C1279955	Entire articular surface, interphalangeal, of phalanx of foot
C1279975	Entire posterior calcaneal articular surface of talus
C1279976	Entire middle calcaneal articular surface of talus
C1279978	Entire navicular calcaneal articular surface of talus
C1279984	Entire navicular facet of cuboid bone
C1280018	Entire bimalleolar area
C1280019	Entire trimalleolar area
C1280033	Entire perihepatic region
C1280036	Entire subhepatic region
C1280037	Entire perisplenic region
C1280039	Entire lateral region of abdomen
C1280041	Entire mid abdomen (surface region)
C1280042	Entire right upper quadrant of abdomen
C1280043	Entire left upper quadrant of abdomen
C1280045	Structure of upper abdominal quadrant
C1280046	Entire right lower quadrant of abdomen
C1280047	Entire left lower quadrant of abdomen
C1280048	Structure of lower abdominal quadrant
C1280064	Body Regions
C1280066	Entire thoracic inlet
C1280080	Entire posterior mediastinum
C1280083	Entire umbilical region
C1280084	Body Regions
C1280087	Entire waist (surface region)
C1280088	Entire perineum
C1280104	Entire nail of finger
C1280105	Entire nail of toe
C1280262	Entire radiating portion of cortical lobule of kidney
C1280276	Entire convoluting portion of cortical lobule of kidney
C1280328	Entire inferior portion of duodenum
C1280329	Entire ascending portion of duodenum
C1280339	Entire anal intersphincteric groove
C1280347	Entire fornix of vagina
C1280377	Entire mesial surface of tooth
C1280378	Entire distal surface of tooth
C1280393	Entire anterior floor of mouth
C1280394	Entire lateral floor of mouth
C1280418	Entire anterior margin of pancreas
C1280446	Entire superior margin of adrenal gland
C1280447	Entire medial margin of adrenal gland
C1280494	Entire intestinal surface of uterus
C1280495	Entire vesical surface of uterus
C1280496	Entire endometrial surface epithelium
C1280499	Entire margin of uterus
C1280595	Entire gastropancreatic folds
